{
  "protocol_version": "tma.workbench_plugin.v1",
  "id": "com.tma.r-survival-workbench",
  "name": "R 语言生存分析",
  "description": "GitLab 项目、远程 R Notebook 与 TMA Agent 的生存分析工作台",
  "version": "0.1.0",
  "entry": "./index.jsx",
  "surfaces": ["web_desktop", "desktop_shell", "web_tablet", "web_mobile"],
  "engines": {
    "workbench_api": ">=1.0.0 <2.0.0",
    "design_system": ">=1.0.0 <2.0.0"
  },
  "permissions": [],
  "contributes": {
    "navigation": [
      {
        "id": "r-survival",
        "group": "workbench",
        "title": "R 语言生存分析",
        "route": "/plugins/com.tma.r-survival-workbench/workbench",
        "order": 100
      }
    ],
    "routes": [
      {
        "id": "workbench",
        "path": "/plugins/com.tma.r-survival-workbench/workbench",
        "component": "RSurvivalWorkbenchPage",
        "required_permissions": []
      }
    ],
    "commands": [
      {
        "id": "com.tma.r-survival-workbench.create-project",
        "title": "创建分析项目",
        "risk": "write",
        "required_permissions": []
      }
    ]
  }
}
